{
  "schema_version": "sys4ai.plan-relay-generation.v1",
  "run_id": "RUN-EXAMPLE-003",
  "generation": 1,
  "task_id": "TASK-A",
  "task_sha256": "aaaaaaaaaaaaaaaaaaaaaaaaaaaaaaaaaaaaaaaaaaaaaaaaaaaaaaaaaaaaaaaa",
  "predecessor_thread_id": "launcher-example",
  "predecessor_receipt_sha256": null,
  "worker_thread_id": "worker-a-example",
  "requested_effort": "max",
  "effective_effort": "max",
  "status": "invocation_unknown",
  "handoff_token_sha256": "bbbbbbbbbbbbbbbbbbbbbbbbbbbbbbbbbbbbbbbbbbbbbbbbbbbbbbbbbbbbbbbb",
  "envelope_sha256": "cccccccccccccccccccccccccccccccccccccccccccccccccccccccccccccccc",
  "invocation_count": 1,
  "receipt_sha256": null,
  "successor_generation": null
}
